{
  "status": "success",
  "persona": "langston_l_model",
  "version": "1.0.0",
  "confidence": 0.94,
  "output": {
    "tool_name": "Engagement Signal Interpreter",
    "intent": "Interpret what engagement signals may mean",
    "results": {
      "signal_insight": "High saves indicate interest in long-form content; steady comments suggest conversation activity.",
      "adjustment": "Make a gentle prompt to invite discussion and ask a question in captions.",
      "calm_reminder": "One post does not define success."
    }
  },
  "notes": [
    "Engagement interpretation is non-urgent and guidance-focused."
  ],
  "warnings": [],
  "errors": []
}
